{
  "description": "Machine-readable requirements that determine whether a software repository is ready for AI coding agents, organized by the four Agent Ready pillars and graded by a requirement-based five-level maturity model.",
  "dimensions": [
    {
      "description": "Secrets hygiene, agent permission boundaries, and automated security gates. These are mostly constraints, with some feedback.",
      "id": "security",
      "sources": [
        "content/module-7/01-why-safety-matters.mdx",
        "content/module-10/03-security-audit.mdx"
      ],
      "title": "Security"
    },
    {
      "description": "Agent efficiency, meaning context budget and navigation cost. It is not application runtime performance.",
      "id": "performance",
      "sources": [
        "content/module-8/04-optimizing-context-budget.mdx",
        "content/module-10/04-performance-optimization.mdx"
      ],
      "title": "Performance"
    }
  ],
  "document_type": "agent-ready.spec",
  "evidence": [
    {
      "category": "agent",
      "description": "An agent instruction file has a section describing project structure or architecture.",
      "detection": {
        "in": [
          "file.agents_md",
          "file.claude_md",
          "file.copilot_instructions",
          "file.cursor_rules",
          "file.gemini_md"
        ],
        "kind": "heading",
        "patterns": [
          "architecture",
          "structure",
          "layout",
          "overview",
          "organi[sz]ation",
          "design",
          "components",
          "modules",
          "data flow",
          "how it works"
        ]
      },
      "id": "agent.instructions.architecture",
      "title": "Instructions describe architecture"
    },
    {
      "category": "agent",
      "description": "An agent instruction file documents at least one runnable project command, for example how to build, test, lint, or run the project.",
      "detection": {
        "definition": "Satisfied when an agent instruction file (the files matched by file.agents_md, file.claude_md, file.copilot_instructions, file.cursor_rules, and file.gemini_md) contains at least one project command. Command lines are inline code spans and the non-blank lines of fenced code blocks. Each command line is split into segments at `&&`, `||`, `;`, and `|`. In each segment a leading `$ ` prompt and leading `NAME=value` environment assignments are ignored, and the first word is the program. A segment is a project command when its program is one of `make`, `just`, `task`, `npm`, `npx`, `pnpm`, `yarn`, `bun`, `bunx`, `deno`, `nx`, `turbo`, `go`, `gofmt`, `golangci-lint`, `cargo`, `uv`, `poetry`, `pdm`, `hatch`, `pipenv`, `pytest`, `tox`, `nox`, `ruff`, `black`, `isort`, `flake8`, `pylint`, `mypy`, `pyright`, `basedpyright`, `eslint`, `prettier`, `biome`, `tsc`, `jest`, `vitest`, `playwright`, `gradle`, `mvn`, `cmake`, `ctest`, `bazel`, `bazelisk`, `swift`, `xcodebuild`, `dotnet`, `mix`, `sbt`, `stack`, `cabal`, `zig`, `rake`, `rspec`, `bundle`, `composer`, or `phpunit`; or `python`, `python3`, or `py` followed by `-m` and one of `pytest`, `unittest`, `mypy`, `ruff`, `black`, `build`, `tox`, `nox`, `pylint`, `flake8`, or `isort`; or a repository path (it starts with `./` or contains `/`) that exists as a file in the repository. A heading alone, or a command of any other program (for example a workflow tool's own commands), is not evidence.",
        "kind": "derived"
      },
      "id": "agent.instructions.commands",
      "title": "Instructions document commands"
    },
    {
      "category": "agent",
      "description": "Root-level agent instruction files stay within a context-friendly size.",
      "detection": {
        "definition": "Satisfied when at least one of `AGENTS.md`, `CLAUDE.md`, or `GEMINI.md` exists at the repository root and every one of those root files that exists has at most 100 non-blank lines. 100 lines is the upper bound the course gives for complex systems. Smaller projects should aim lower.",
        "kind": "derived"
      },
      "id": "agent.instructions.concise",
      "title": "Root instructions are concise"
    },
    {
      "category": "agent",
      "description": "An agent instruction file has a section stating rules, prohibitions, or boundaries.",
      "detection": {
        "in": [
          "file.agents_md",
          "file.claude_md",
          "file.copilot_instructions",
          "file.cursor_rules",
          "file.gemini_md"
        ],
        "kind": "heading",
        "patterns": [
          "don'?t",
          "do not",
          "never",
          "must not",
          "constraint",
          "rule",
          "boundar",
          "restriction",
          "guardrail",
          "forbidden",
          "off-limits",
          "safety",
          "caution",
          "avoid",
          "permission"
        ]
      },
      "id": "agent.instructions.constraints",
      "title": "Instructions state constraints"
    },
    {
      "category": "agent",
      "description": "An agent instruction file has a section documenting code style or conventions.",
      "detection": {
        "in": [
          "file.agents_md",
          "file.claude_md",
          "file.copilot_instructions",
          "file.cursor_rules",
          "file.gemini_md"
        ],
        "kind": "heading",
        "patterns": [
          "convention",
          "style",
          "pattern",
          "standard",
          "guideline",
          "idiom",
          "naming",
          "best practice"
        ]
      },
      "id": "agent.instructions.conventions",
      "title": "Instructions document conventions"
    },
    {
      "category": "agent",
      "description": "An agent instruction file has a section pointing to examples or reference implementations to follow.",
      "detection": {
        "in": [
          "file.agents_md",
          "file.claude_md",
          "file.copilot_instructions",
          "file.cursor_rules",
          "file.gemini_md"
        ],
        "kind": "heading",
        "patterns": [
          "example",
          "exemplar",
          "reference implementation",
          "pattern to follow",
          "follow this",
          "canonical",
          "template"
        ]
      },
      "id": "agent.instructions.examples",
      "title": "Instructions point to exemplars"
    },
    {
      "category": "agent",
      "description": "Agent instructions tell the agent where code lives instead of leaving it to search.",
      "detection": {
        "definition": "Satisfied when the agent instruction files matched by file.agents_md, file.claude_md, file.copilot_instructions, file.cursor_rules, and file.gemini_md together reference at least two distinct repository-relative paths that exist in the worktree. A reference is the text of an inline code span or a Markdown link target that contains `/` or a file extension. After removing a leading `./`, a trailing `/`, and any `#fragment`, it must name an existing file or directory. URLs, absolute paths, and paths containing `..` are not references.",
        "kind": "derived"
      },
      "id": "agent.instructions.file_pointers",
      "title": "Instructions point to concrete paths"
    },
    {
      "category": "agent",
      "description": "Instruction files exist below the repository root and scope guidance to specific areas.",
      "detection": {
        "kind": "path",
        "paths": [
          "*/**/AGENTS.md",
          "*/**/CLAUDE.md",
          "*/**/GEMINI.md",
          ".github/instructions/*.instructions.md"
        ]
      },
      "id": "agent.instructions.nested",
      "title": "Scoped instruction files"
    },
    {
      "category": "agent",
      "description": "An agent instruction file contains explicit prohibition bullets (\"Do not …\", \"Never …\").",
      "detection": {
        "in": [
          "file.agents_md",
          "file.claude_md",
          "file.copilot_instructions",
          "file.cursor_rules",
          "file.gemini_md"
        ],
        "kind": "content",
        "patterns": [
          "^\\s*([-*+]|\\d+\\.)\\s+(\\*\\*|__)?(do not|don't|never|must not|avoid)\\b"
        ]
      },
      "id": "agent.instructions.prohibitions",
      "title": "Instructions list prohibitions"
    },
    {
      "category": "agent",
      "description": "An agent instruction file mentions how secrets and credentials must be handled.",
      "detection": {
        "in": [
          "file.agents_md",
          "file.claude_md",
          "file.copilot_instructions",
          "file.cursor_rules",
          "file.gemini_md"
        ],
        "kind": "content",
        "patterns": [
          "secret",
          "credential",
          "\\.env\\b",
          "api[ _-]?key",
          "private key",
          "password"
        ]
      },
      "id": "agent.instructions.secrets_policy",
      "title": "Instructions address secrets"
    },
    {
      "category": "agent",
      "description": "An agent instruction file documents common tasks as step-by-step workflows.",
      "detection": {
        "in": [
          "file.agents_md",
          "file.claude_md",
          "file.copilot_instructions",
          "file.cursor_rules",
          "file.gemini_md"
        ],
        "kind": "heading",
        "patterns": [
          "workflow",
          "how to",
          "common task",
          "recipe",
          "playbook",
          "procedure",
          "step[- ]by[- ]step",
          "adding a",
          "adding new",
          "checklist"
        ]
      },
      "id": "agent.instructions.workflows",
      "title": "Instructions document task workflows"
    },
    {
      "category": "agent",
      "description": "The repository commits an agent permission or sandbox configuration.",
      "detection": {
        "kind": "content",
        "paths": [
          ".claude/settings.json",
          ".codex/config.toml"
        ],
        "patterns": [